<!ELEMENT lop (sinhvien+)>

<!ELEMENT sinhvien (id, name, subjects)>
<!ELEMENT id (#PCDATA)>
<!ELEMENT name (#PCDATA)>

<!ELEMENT subjects (subject+)>
<!ELEMENT subject (subject_name, score)>
<!ELEMENT subject_name (#PCDATA)>
<!ELEMENT score (#PCDATA)>